{
  "schema_version": 1,
  "audit_id": "spine_004_completion_audit",
  "version": 1,
  "inputs": [
    {
      "path": "data/reviewed/source-dispositions-v1.json",
      "sha256": "15824d8281d9e6669eddc40780e3f9ab3113866834c7fae997b2de76bf92a32d"
    },
    {
      "path": "data/reviewed/communicative-function-strands-v1.json",
      "sha256": "84cef12823195ce803b9f4945406188ac8ad3c20eb0968c3f385dce0605153f2"
    },
    {
      "path": "data/reviewed/grammar-family-strands-v1.json",
      "sha256": "00a83dbe2818a1aec6f668fbf26182da5cfef6528b1c7e6afbbb3f7e915aec7e"
    },
    {
      "path": "data/reviewed/lexical-progression-strands-v1.json",
      "sha256": "28d0fd13052ecc703f1260935163ba2d0286d8782ca317cd7777ef878a3c012c"
    },
    {
      "path": "data/reviewed/pronunciation-progression-strands-v1.json",
      "sha256": "2f060773421312ca67f1f54067e032757f188f212109874b32296461a191be3c"
    },
    {
      "path": "data/reviewed/performance-complexity-strands-v1.json",
      "sha256": "60c3810d624bf47dfc454b3cbc20466897baa861ca3767d9963b10053f86e70e"
    }
  ],
  "source_ownership": {
    "normalized_record_count": 9274,
    "primary_partitions": [
      {
        "partition": "communicative_boundary_evidence",
        "source_dataset_ids": [
          "cefr_all_descriptors",
          "gse_all_objectives"
        ],
        "source_record_count": 2274
      },
      {
        "partition": "grammar_system_evidence",
        "source_dataset_ids": [
          "egp_all_levels",
          "gse_grammar_all"
        ],
        "source_record_count": 1678
      },
      {
        "partition": "lexical_reference_evidence",
        "source_dataset_ids": [
          "oxford_3000_all",
          "oxford_5000_all"
        ],
        "source_record_count": 5322
      }
    ],
    "owned_record_count": 9274,
    "unowned_source_dataset_ids": [],
    "duplicate_primary_dataset_owners": []
  },
  "components": [
    {
      "component": "communicative_abilities",
      "artifact": "communicative-function-strands-v1.json",
      "controlled_family_count": 41,
      "lifecycle_stage_count": 238,
      "source_record_coverage": 2274,
      "validation_status": "pass"
    },
    {
      "component": "grammar_and_sentence_patterns",
      "artifact": "grammar-family-strands-v1.json",
      "controlled_family_count": 91,
      "lifecycle_stage_count": 567,
      "source_record_coverage": 1678,
      "validation_status": "pass"
    },
    {
      "component": "vocabulary_phraseology_and_register",
      "artifact": "lexical-progression-strands-v1.json",
      "controlled_family_count": 10,
      "lifecycle_stage_count": 60,
      "source_record_coverage": 5322,
      "validation_status": "pass"
    },
    {
      "component": "pronunciation_and_intelligibility",
      "artifact": "pronunciation-progression-strands-v1.json",
      "controlled_family_count": 10,
      "lifecycle_stage_count": 60,
      "source_record_coverage": 1224,
      "validation_status": "pass"
    },
    {
      "component": "discourse_interaction_and_complexity",
      "artifact": "performance-complexity-strands-v1.json",
      "controlled_family_count": 15,
      "lifecycle_stage_count": 90,
      "source_record_coverage": 1224,
      "validation_status": "pass"
    }
  ],
  "global_lifecycle_audit": {
    "controlled_family_count": 167,
    "lifecycle_stage_count": 1015,
    "invalid_level_regressions": [],
    "missing_consolidation": [],
    "missing_post_consolidation_recycle": [],
    "unexplained_orphans": []
  },
  "controlled_item_boundary": {
    "status": "family_spine_complete_item_selection_belongs_to_level_reconciliation",
    "source_rows_are_not_automatic_targets": true,
    "current_a1_working_targets_are_final": false,
    "next_required_action": "Reconcile every current A1 candidate and select exact controlled forms, meanings, chunks, and pronunciation targets in SPINE-005."
  },
  "named_non_blocking_limits": [
    {
      "limit_id": "oxford_no_c2_pool",
      "treatment": "Use the accepted registered corpus and domain evidence method before any C2 item selection."
    },
    {
      "limit_id": "gse_grammar_no_c2_rows",
      "treatment": "Use EGP and CEFR as primary C2 boundaries; do not invent a GSE Grammar cross-check."
    },
    {
      "limit_id": "discourse_markers_without_named_gse_category",
      "treatment": "Retain EGP family evidence and CEFR discourse progression without claiming a missing crosswalk."
    },
    {
      "limit_id": "cefr_does_not_supply_english_arabic_pronunciation_sequence",
      "treatment": "Keep the English sequence as a product decision and all Arabic risks as validation-pending hypotheses."
    },
    {
      "limit_id": "exact_items_and_lesson_owners_not_yet_selected",
      "treatment": "Select and audit them during A1 reconciliation, then repeat the method for later levels."
    }
  ],
  "external_validation_obligations": [
    "Arabic-English pronunciation specialist review before learner-risk hypotheses become target rules.",
    "Dialect-aware learner observation before individual pronunciation remediation is prescribed.",
    "Register and licence every corpus or domain source before C2 lexical item selection."
  ],
  "gate_decision": {
    "status": "pass_for_a1_reconciliation",
    "completed_task": "SPINE-004",
    "next_task": "SPINE-005",
    "mass_a1_production": "remains_blocked_until_SPINE-006"
  },
  "review": {
    "status": "accepted",
    "reviewer": "codex_primary_curriculum_agent",
    "reviewed_at": "2026-08-10T14:04:49+03:00",
    "method": "component_validation_source_partition_and_cross_component_completion_audit"
  }
}
